{"covered_through":5,"events":[{"body":{"type":"session.message","html":"\u003ctag\u003e\u0026","line":"\u2028\u2029","text":"first public event"},"event_id":"event-2","journal_seq":2},{"body":{"type":"session.message","html":"\u003ctag\u003e\u0026","line":"\u2028\u2029","text":"second public event"},"event_id":"event-5","journal_seq":5}],"journal_tip":5,"next_cursor":"opaque-older-page","previous_cursor":"opaque-newer-page"}
